{
  "$schema": "https://json-schema.org/draft/2020-12/schema",
  "$id": "https://sdd-harness.local/schemas/work-item.schema.json",
  "title": "SDD Work Item",
  "type": "object",
  "required": ["schema_version", "kind", "id", "title", "type", "status", "workflow", "input", "phases", "traceability"],
  "properties": {
    "schema_version": { "const": "0.1" },
    "kind": { "const": "work-item" },
    "id": { "type": "string", "pattern": "^[a-z0-9]+(?:-[a-z0-9]+)*$" },
    "title": { "type": "string", "minLength": 1 },
    "type": { "type": "string" },
    "status": { "enum": ["active", "completed", "archived", "cancelled"] },
    "created_at": { "type": "string", "format": "date-time" },
    "created_by": { "$ref": "#/$defs/actor" },
    "workflow": {
      "type": "object",
      "required": ["id", "version", "entry_phase"],
      "properties": { "id": { "type": "string" }, "version": { "type": "string" }, "entry_phase": { "type": "string" } },
      "additionalProperties": false
    },
    "input": {
      "type": "object",
      "required": ["source", "summary"],
      "properties": { "source": { "enum": ["user_prompt", "external_artifact", "imported_artifact"] }, "summary": { "type": "string" }, "references": { "type": "array", "items": { "type": "string" } } },
      "additionalProperties": false
    },
    "phases": { "type": "object", "additionalProperties": { "$ref": "#/$defs/phaseState" } },
    "approvals": { "type": "array", "items": { "$ref": "#/$defs/approval" } },
    "traceability": { "type": "object", "required": ["events"], "properties": { "events": { "const": "events.jsonl" }, "related_work_items": { "type": "array", "items": { "type": "string" } }, "baseline_specs": { "type": "array", "items": { "type": "string" } } }, "additionalProperties": false },
    "observability": { "$ref": "#/$defs/observability" }
  },
  "$defs": {
    "actor": { "type": "object", "required": ["kind", "id"], "properties": { "kind": { "enum": ["human", "agent", "cli", "system"] }, "id": { "type": "string" } }, "additionalProperties": false },
    "phaseState": { "type": "object", "required": ["status"], "properties": { "status": { "enum": ["not_applicable", "blocked", "ready", "in_progress", "awaiting_approval", "approved", "completed", "rejected", "accepted", "superseded"] }, "artifact": { "type": "string" } }, "additionalProperties": false },
    "approval": { "type": "object", "required": ["phase", "status"], "properties": { "phase": { "type": "string" }, "status": { "enum": ["pending", "approved", "rejected", "superseded"] }, "by": { "$ref": "#/$defs/actor" }, "at": { "type": "string", "format": "date-time" }, "comment": { "type": "string" } }, "additionalProperties": false },
    "observability": { "type": "object", "properties": { "token_usage": { "type": "object", "required": ["status"], "properties": { "status": { "enum": ["not_reported", "partial", "recorded"] }, "source": { "type": ["string", "null"] }, "input_tokens": { "type": ["integer", "null"], "minimum": 0 }, "output_tokens": { "type": ["integer", "null"], "minimum": 0 }, "cache_read_tokens": { "type": ["integer", "null"], "minimum": 0 }, "cache_write_tokens": { "type": ["integer", "null"], "minimum": 0 } }, "additionalProperties": false } }, "additionalProperties": false }
  },
  "additionalProperties": false
}
