{
  "schema_version": "0.1",
  "kind": "work-item",
  "id": "bug-002-crash-on-refresh",
  "title": "Crash al refrescar la pantalla de pago",
  "type": "bug",
  "status": "completed",
  "created_at": "2026-08-14T23:00:00Z",
  "created_by": {
    "kind": "human",
    "id": "matias"
  },
  "workflow": {
    "id": "bug-investigation",
    "version": "0.1",
    "entry_phase": "issue"
  },
  "input": {
    "source": "user_prompt",
    "summary": "El usuario reporta que al recargar la página en el checkout, la app da un pantallazo blanco."
  },
  "phases": {
    "issue": {
      "status": "completed",
      "artifact": "artifacts/issue.md"
    },
    "debugging": {
      "status": "completed",
      "artifact": "artifacts/exploration.md"
    },
    "plan": {
      "status": "approved",
      "artifact": "artifacts/plan.md"
    },
    "implementation": {
      "status": "completed",
      "artifact": "artifacts/implementation-report.md"
    },
    "verification": {
      "status": "completed",
      "artifact": "artifacts/verification-report.md"
    },
    "human-code-review": {
      "status": "approved",
      "artifact": "artifacts/human-code-review.md"
    },
    "archive": {
      "status": "completed",
      "artifact": "artifacts/archive.md"
    }
  },
  "approvals": [
    {
      "phase": "plan",
      "status": "approved",
      "by": {
        "kind": "human",
        "id": "matias"
      },
      "at": "2026-08-14T23:20:00Z"
    },
    {
      "phase": "human-code-review",
      "status": "approved",
      "by": {
        "kind": "human",
        "id": "matias"
      },
      "at": "2026-08-14T23:45:00Z"
    }
  ],
  "traceability": {
    "events": "events.jsonl"
  }
}
