{
  "schema_version": "0.1",
  "kind": "work-item",
  "id": "fast-001-fix-typo",
  "title": "Corregir typo en botón de guardar",
  "type": "fast-change",
  "status": "completed",
  "created_at": "2026-08-14T23:00:00Z",
  "created_by": {
    "kind": "human",
    "id": "matias"
  },
  "workflow": {
    "id": "fast-change",
    "version": "0.1",
    "entry_phase": "plan"
  },
  "input": {
    "source": "user_prompt",
    "summary": "Corregir typo en la etiqueta del botón de guardar en el perfil."
  },
  "phases": {
    "plan": {
      "status": "approved",
      "artifact": "artifacts/plan.md"
    },
    "implementation": {
      "status": "completed",
      "artifact": "artifacts/implementation-report.md"
    },
    "verification": {
      "status": "completed",
      "artifact": "artifacts/verification-report.md"
    },
    "human-code-review": {
      "status": "approved",
      "artifact": "artifacts/human-code-review.md"
    },
    "archive": {
      "status": "completed",
      "artifact": "artifacts/archive.md"
    }
  },
  "approvals": [
    {
      "phase": "plan",
      "status": "approved",
      "by": {
        "kind": "human",
        "id": "matias"
      },
      "at": "2026-08-14T23:10:00Z"
    },
    {
      "phase": "human-code-review",
      "status": "approved",
      "by": {
        "kind": "human",
        "id": "matias"
      },
      "at": "2026-08-14T23:25:00Z"
    }
  ],
  "traceability": {
    "events": "events.jsonl"
  }
}
